{
  "message_type": "ROLE_CRITIQUE",
  "sender_role": "Foresight",
  "task_id": "e4b3c1d2-5678-90ab-cdef-1234567890ab",
  "content": {
    "analysis": "Simulation shows 62% efficiency gain but 28% risk of privacy incidents without safeguards."
  },
  "metrics": {
    "confidence": 0.82,
    "cost": 0.031,
    "trust_score_delta": 0.11,
    "risk_quantification": { "low": 0.1, "medium": 0.62, "high": 0.28 }
  },
  "audit_trail": {
    "timestamp": "2025-12-16T12:00:10Z",
    "previous_message_id": "02_wisdom_analysis",
    "conflicts": ["Mild disagreement with Wisdom on acceptable risk threshold"]
  }
}
