{
  "message_type": "TASK_INIT",
  "sender_role": "Bus",
  "task_id": "e4b3c1d2-5678-90ab-cdef-1234567890ab",
  "content": {
    "analysis": "User query received and normalized",
    "query": "Should we deploy a new AI chatbot for customer service?"
  },
  "metrics": { "confidence": 1.0, "cost": 0.001 },
  "audit_trail": { "timestamp": "2025-12-16T12:00:00Z", "conflicts": [] }
}
