{
  "message_type": "RESOLUTION_PROPOSAL",
  "sender_role": "Precision",
  "task_id": "e4b3c1d2-5678-90ab-cdef-1234567890ab",
  "content": {
    "analysis": "Final recommendation: Proceed with phased rollout after security audit and pilot testing."
  },
  "metrics": { "confidence": 0.89, "cost": 0.008, "trust_score_delta": 0.21 },
  "audit_trail": { "timestamp": "2025-12-16T12:00:20Z", "previous_message_id": "04_empathy_evaluation" }
}
